url,Document_id,Access_Frequency,Unique_Visitor_Count,Duration,Hubs,Initial_polulation,Authorities,rank
Python program to find Cumulative sum of a list,330,346,920,38,712,332,624,330
Find all the numbers in a string using regular expression in Python,331,264,499,317,575,798,751,880
Python Program for Reversal algorithm for array rotation,332,279,299,720,471,483,985,420
Python | Tokenizing strings in list of strings,333,722,310,249,744,821,577,951
Python | Append multiple lists at once,334,774,619,267,574,87,788,426
Python | Count keys with particular value in dictionary,335,61,312,412,515,481,280,212
Python Program to Convert Decimal to Hexadecimal,336,394,970,583,793,401,189,688
Python program to Compute a Polynomial Equation,337,944,428,747,133,154,727,268
Python - Update values of a list of dictionaries,338,408,813,554,918,583,659,958
Python Program To Remove Duplicates From A Given String,339,224,819,656,84,193,981,507
Python | Binary list to integer,340,494,862,398,444,507,834,490
Python - Key Value list pairings in Dictionary,341,636,218,122,239,47,301,100
Python program to split the string and convert it to dictionary,342,525,366,605,413,227,652,965
Create a tuple from string and list - Python,343,597,273,234,816,38,73,251
Python Program for Counting Sort,344,39,89,262,270,624,836,976
Python Program to Find the Total Sum of a Nested List Using Recursion,345,373,346,309,182,596,243,669
Python | Test if all elements are present in list,346,165,597,500,844,440,106,731
Python Delete File,347,267,496,684,972,69,705,639
Python - Find index of maximum item in list,348,335,587,88,564,400,688,141
Rename multiple files using Python,349,436,999,27,884,738,318,58
Python | Count number of items in a dictionary value that is a list,350,315,353,876,463,327,377,547
Python | Check if dictionary is empty,351,270,341,82,292,646,350,221
Spelling checker in Python,352,561,992,5,307,58,713,870
Python | Check if list contains consecutive numbers,353,108,49,621,308,77,364,793
Python | Combine the values of two dictionaries having same key,354,420,692,639,347,474,979,365
Python | Get first N key:value pairs in given dictionary,355,660,209,263,196,970,750,648
Python | Check if element is present in tuple,356,43,765,738,738,516,284,710
Python | Convert Numpy Arrays to Tuples,357,615,578,933,67,360,287,571
Python | Avoiding quotes while printing strings,358,371,136,352,657,919,868,179
Python - Convert List to delimiter separated String,359,800,860,252,235,692,314,779
Python - Create Dictionary Of Tuples,360,507,936,97,902,491,649,741
Python program to check if given string is pangram,361,158,585,25,968,683,844,774
Python Program to check if given array is Monotonic,362,128,272,254,334,308,244,348
Python program to validate an IP Address,363,262,442,678,826,802,470,901
Python | Get the substring from given string using list slicing,364,795,472,658,187,90,294,328
Python | Extract numbers from list of strings,365,69,815,763,117,174,795,697
Python program to calculate square of a given number,366,358,572,885,260,411,89,776
Check if the given push and pop sequences of Stack is valid or not,367,966,314,435,929,241,281,832
Python | Convert a set into dictionary,368,916,319,993,947,216,514,506
Python | Remove duplicate tuples from list of tuples,369,387,355,907,222,790,150,271
Python - Maximum and Minimum K elements in Tuple,370,556,14,160,162,594,477,853
Python | Convert list of strings to space separated string,371,859,524,470,804,910,807,722
Python | Difference in keys of two dictionaries,372,622,266,557,282,698,161,265
Python - Words Frequency in String Shorthands,373,187,262,826,218,509,810,887
Python - Evaluate Expression given in String,374,451,277,643,385,82,583,935
Python - Convert HTML Characters To Strings,375,939,565,330,389,925,849,576
Python Program For Inserting A Node In A Linked List,376,130,363,363,834,843,978,79
Python program to convert binary to ASCII,377,633,780,356,363,318,278,675
How to capitalize first character of string in Python,378,629,792,581,237,963,954,308
Python | Get random dictionary pair,379,385,779,307,602,853,946,781
Python Program to Find Numbers Divisible by 7 and Multiple of 5 in a Given Range,380,818,379,806,980,854,142,1
Implementing Web Scraping in Python with Scrapy,381,356,836,872,971,272,803,985
Python | Check if substring is part of List of Strings,382,348,245,723,309,803,816,130
Python Program for Radix Sort,383,432,753,141,86,831,594,513
Python - Create dictionary from the list,384,290,614,481,179,260,388,790
Python program to get all subsets of given size of a set,385,610,227,850,723,345,772,166
Python program to input a comma separated string,386,714,221,4,936,106,109,293
"Python - Get number of characters, words, spaces and lines in a file",387,503,307,459,891,293,435,98
GUI chat application using Tkinter in Python,388,593,36,256,294,699,456,551
Python | Move element to end of the list,389,878,331,1,147,80,167,16
Python | Substring Key match in dictionary,390,329,924,185,4,486,154,171
Python | Adding K to each element in a list of integers,391,59,113,889,490,478,840,998
Python | Remove unwanted spaces from string,392,737,313,959,73,614,771,190
Python | Convert nested dictionary into flattened dictionary,393,550,841,432,82,923,392,690
Python | Check for spaces in string,394,457,680,832,277,917,210,82
Python - Extract date in String,395,896,684,318,819,973,172,168
Python Program for Coin Change,396,969,98,10,690,395,78,321
Python | Check if all the values in a list are less than a given value,397,941,455,931,832,644,110,645
Python Django | Google authentication and Fetching mails from scratch,398,479,883,997,343,546,602,323
Python | Split given string into equal halves,399,694,351,518,525,661,945,317
Python - Test if all Values are Same in Dictionary,400,463,448,297,771,358,635,78
Python | Unpacking dictionary keys into tuple,401,784,715,196,320,548,674,496
Python | Shift from Front to Rear in List,402,9,248,637,407,50,121,473
Car Race Game In PyGame,403,558,416,55,543,658,100,750
Python - Unique Tuple Frequency (Order Irrespective),404,903,784,756,251,645,829,198
Python | Add one string to another,405,520,840,49,446,575,202,579
Python program to find day of the week for a given date,406,151,316,85,297,278,472,866
Python | Convert list into list of lists,407,352,431,295,532,385,229,740
Sort numeric strings in a list in Python,408,591,133,988,36,85,63,112
Python program to print all positive numbers in a range,409,642,631,114,214,5,422,908
Python | Min and Max value in list of tuples,410,579,527,728,185,706,7,388
Python Program to print all permutations of a given string,411,626,758,509,78,234,938,830
Python | Check if all elements in list follow a condition,412,983,404,693,269,751,759,406
Python program to find the sum of all even and odd digits of an integer list,413,733,345,852,146,562,833,601
Python | Convert list of tuples to list of list,414,99,588,916,854,419,336,353
Python program to get Current Time,415,137,683,207,773,204,848,247
Python | N largest values in dictionary,416,5,465,561,717,842,84,565
Python - Assign values to initialized dictionary keys,417,403,872,902,227,498,853,291
Python - Negative index of Element in List,418,203,438,96,382,387,606,636
Python - Add Space between Potential Words,419,219,60,493,820,292,322,661
Python | Interconversion between Dictionary and Bytes,420,388,257,599,509,966,155,664
Python - Print the last word in a sentence,421,616,867,962,674,258,178,505
Python | Remove random element from list,422,901,440,974,419,525,801,511
Python | Shuffle two lists with same order,423,28,43,283,257,235,300,621
Python Program for Deleting a Node in a Linked List,424,23,732,235,570,871,799,277
Python | Updating value list in dictionary,425,46,250,59,152,485,702,123
Data Science Methodology and Approach,426,16,96,556,940,995,765,115
Python | Size of string in memory,427,240,34,73,310,912,180,196
Python - Clearing a tuple,428,409,849,892,600,974,683,929
Print Even and Odd Index Characters of a String - Python,429,786,212,291,623,32,141,758
"Python program to print current year, month and day",430,229,608,768,818,721,507,607
Python Script to Shutdown Computer,431,577,654,614,303,105,781,296
Python | Combine two dictionary adding values for common keys,432,910,656,100,966,972,187,107
Python | Extract key-value of dictionary in variables,433,143,37,989,202,514,959,26
Python | Check if a list exists in given list of lists,434,213,21,886,729,161,173,748
Python | Ways to format elements of given list,435,452,323,45,390,221,776,638
Linear Regression Using Tensorflow,436,797,543,903,418,879,449,289
Add Substring at Specific Index Python,437,27,896,521,765,111,70,394
Python - Draw Hexagon Using Turtle Graphics,438,476,711,731,281,937,991,527
Python | Boolean List AND and OR operations,439,107,24,328,9,378,887,575
Intermediate Coding Problems in Python,440,634,941,341,278,1,737,974
Python program to calculate the number of words and characters in the string,441,419,291,375,607,404,126,810
Python | Ways to sort list of float values,442,937,41,452,250,113,830,155
Python | Matrix creation of n*n,443,361,140,669,386,246,224,936
Sending Emails Using API in Flask-Mail,444,698,852,714,252,134,812,238
Python - Remove Negative Elements in List,445,748,23,896,831,294,118,871
Python program to convert any base to decimal by using int() method,446,580,408,405,171,822,873,145
How to Zip two lists of lists in Python?,447,35,48,695,344,727,218,711
Python - Convert List to List of dictionaries,448,155,749,395,807,687,645,46
Python | Printing String with double quotes,449,566,318,290,714,537,779,418
Python - Check for Sublist in List,450,664,478,315,588,911,233,886
Python | Repeat each element K times in list,451,323,369,757,973,636,586,751
Python | Ways to split strings using newline delimiter,452,611,267,106,752,797,694,745
Python | Sum of squares in list,453,989,576,855,205,756,432,338
Python Program for Cocktail Sort,454,885,203,403,548,571,276,230
Python - Frequency of elements from other list,455,486,28,797,982,535,473,290
Python Program for Longest Common Subsequence,456,801,188,543,429,563,944,510
Python Program for nth multiple of a number in Fibonacci Series,457,529,388,47,784,804,896,447
Python Program to generate one-time password (OTP),458,397,947,346,459,142,899,702
Python | Grouping dictionary keys by value,459,965,226,618,215,857,402,396
Python | Sum list of dictionaries with same key,460,612,437,846,916,930,295,456
Python | Ways to sum list of lists and return sum list,461,745,677,52,451,355,893,841
Python | Remove multiple keys from dictionary,462,640,986,645,81,176,640,914
Python | Find missing numbers in a sorted list range,463,671,87,162,491,448,308,111
Python - Replace dictionary value from other dictionary,464,232,503,623,770,961,740,487
Python program for most frequent word in Strings List,465,832,568,303,6,903,195,950
Python | Iterate through value lists dictionary,466,528,629,131,580,131,268,150
Python - Ways to remove multiple empty spaces from string List,467,915,824,881,686,888,845,915
Python | Insert character after every character pair,468,171,102,260,121,626,170,952
Python | Last occurrence of some element in a list,469,967,58,247,776,932,208,912
Python - Find Index containing String in List,470,540,106,603,554,139,572,681
Python - os.pardir() method with example,471,221,863,448,470,181,620,520
Python | Find maximum length sub-list in a nested list,472,7,859,580,586,467,685,172
Python | Ways to split strings on Uppercase characters,473,454,741,76,220,590,59,235
Python | Move one list element to another list,474,277,697,593,985,231,153,597
Python - Append items at beginning of dictionary,475,963,975,894,45,343,437,522
Python program to find the longest word in a sentence,476,747,994,200,189,299,407,757
Python - Convert Tuple String to Integer Tuple,477,594,420,741,168,726,365,471
Python | Remove last K elements of list,478,760,386,402,464,190,519,25
Python | Intersect two dictionaries through keys,479,325,161,787,458,512,554,744
Python Program For Stock Buy Sell To Maximize Profit,480,545,881,944,787,125,912,604
Python - Case insensitive string replacement,481,133,820,360,557,447,541,312
Python Program to Sort Words in Alphabetical Order,482,894,328,620,783,615,915,455
Python Program to find the cube of each list element,483,306,80,81,138,96,288,373
Python | Remove given character from Strings list,484,434,56,547,992,391,81,692
Python - Constant Multiplication over List,485,736,516,324,892,383,650,612
Python | Sort list of dates given as strings,486,757,825,654,593,43,790,895
Python program to create a list of tuples from given list having number and its cube in each tuple,487,418,235,778,258,95,758,525
Python | Extract only characters from given string,488,327,460,744,316,46,575,287
Python Program to find the Quotient and Remainder of two numbers,489,767,198,127,268,103,279,386
Get Your System Information - Using Python Script,490,867,912,578,835,244,162,755
Python - Substituting patterns in text using regex,491,731,163,279,943,66,838,799
Python | Initializing multiple lists,492,985,618,278,348,16,334,281
Python Program for Find remainder of array multiplication divided by n,493,685,702,460,637,896,54,857
Python | Ways to find nth occurrence of substring in a string,494,624,772,710,965,236,503,61
Python - Replace all numbers by K in given String,495,979,580,937,339,691,293,337
Python - Replace vowels in a string with a specific character K,496,86,766,655,47,976,369,991
Python - Convert Lists of List to Dictionary,497,255,230,496,384,722,663,462
Remove common elements from two list in Python,498,124,521,241,661,18,662,534
Python program to find occurrence to each character in given string,499,870,254,955,139,641,146,320
Python | Subtraction of dictionaries,500,862,390,535,65,152,629,654
,,,,,,,,
,,,,,,,,
,,,,,,,,
,,,,,,,,
,,,,,,,,
,,,,,,,,
,,,,,,,,
,,,,,,,,
,,,,,,,,
,,,,,,,,
,,,,,,,,
,,,,,,,,
,,,,,,,,
,,,,,,,,
,,,,,,,,
