url,Document_id,Access_Frequency,Unique_Visitor_Count,Duration,Hubs,Initial_polulation,Authorities,rank
,1,126,544,305,542,435,484,102
Python Program to Check Prime Number,2,992,63,72,995,628,239,539
Python | Get dictionary keys as a list,3,609,775,48,545,417,564,619
Python | Split string into list of characters,4,12,889,184,863,462,859,554
Python Program to Print the Fibonacci sequence,5,947,831,607,299,277,259,342
Python Program to Convert a List to String,6,73,983,828,514,73,26,865
Convert String Dictionary to Dictionary Python,7,245,606,389,799,693,96,117
Convert a List to Dictionary Python,8,390,433,102,566,902,956,635
Python Program for Binary Search (Recursive and Iterative),9,914,453,441,772,206,157,56
Python Program to Add Two Numbers,10,743,132,166,149,460,25,377
Iterate over characters of a string in Python,11,522,875,794,247,177,770,845
Python - Initialize empty array of given length,12,824,367,958,393,421,441,469
Python Program for Bubble Sort,13,613,842,32,198,471,45,703
Add a key:value pair to dictionary in Python,14,599,467,333,132,296,65,303
Python Program to Swap Two Elements in a List,15,170,574,936,74,914,988,864
Python Program for QuickSort,16,50,75,824,204,285,134,260
Python | Convert set into a list,17,495,921,105,399,543,105,606
Python Program for Merge Sort,18,720,483,191,12,776,112,570
Python Program to Find the Factorial of a Number,19,345,434,704,259,967,457,366
Python program to interchange first and last elements in a list,20,216,445,180,265,835,151,149
Python | Remove spaces from a string,21,880,913,266,216,865,393,442
Appending to list in Python dictionary,22,866,943,243,306,677,324,573
Backward iteration in Python,23,57,823,457,766,455,274,714
"Differences and Applications of List, Tuple, Set and Dictionary in Python",24,121,770,563,741,380,579,176
How to print without newline in Python?,25,2,847,465,523,593,108,219
Python | Create list of numbers with given range,26,337,423,782,31,402,221,227
Removing newline character from string in Python,27,109,584,667,503,579,768,69
Python | Remove punctuation from string,28,628,906,492,465,907,419,498
Python | Convert a List into a Tuple,29,101,870,522,677,386,475,984
Python Program to Check Armstrong Number,30,296,45,26,466,183,23,843
Python | Convert String to bytes,31,294,103,17,923,764,556,558
Python Program to Find Largest Number in a List,32,689,406,891,285,717,303,384
Python Program to Find Sum of Array,33,380,62,66,591,100,611,63
Python program to find sum of elements in list,34,682,601,814,302,982,603,174
Check if a variable is string in Python,35,974,65,980,867,868,983,464
Get first and last elements of a list in Python,36,148,987,979,2,270,593,749
Python Program for Insertion Sort,37,805,124,220,223,860,228,322
Remove multiple elements from a list in Python,38,641,513,674,510,410,502,662
Python | Extract numbers from string,39,41,611,722,128,539,498,226
Python - Get Last N characters of a string,40,377,535,461,90,226,410,738
Python Program for Simple Interest,41,77,292,562,153,895,58,350
Python | Append String to list,42,314,168,99,817,733,661,444
Python | Convert a string representation of list into list,43,595,241,169,565,13,405,873
Python program to convert decimal to binary number,44,440,839,366,595,809,631,559
Python program to find smallest number in a list,45,679,405,61,360,667,839,970
Python | Get the first key in dictionary,46,449,603,426,412,859,234,37
Python program to count words in a sentence,47,386,373,841,900,766,835,686
Python | Find most frequent element in a list,48,428,374,67,263,158,420,660
Python Program for Dijkstra's shortest path algorithm | Greedy Algo-7,49,33,497,223,585,894,467,785
Python Program for Selection Sort,50,526,293,472,836,352,448,452
Python program to find second largest number in a list,51,742,400,343,46,500,749,846
How to inverse a matrix using NumPy,52,955,948,112,613,875,2,404
Python Program for Sum the digits of a given number,53,70,602,960,937,862,654,564
Python - Convert JSON to string,54,496,265,477,499,829,595,121
Python Program to Sort a String,55,925,199,428,719,112,62,236
Python program to Remove Last character from the string,56,235,130,963,330,223,858,596
Python program to print even numbers in a list,57,492,829,504,469,770,992,913
Python | Get key with maximum value in Dictionary,58,893,897,733,687,465,538,316
Python | Convert number to list of integers,59,166,925,498,855,21,499,457
Python | Check if a given object is list or not,60,982,605,772,183,991,216,298
Python Program to Find Largest Element in an Array,61,401,275,92,5,541,285,699
Python | Get values of particular key in list of dictionaries,62,241,477,406,333,141,644,332
Python | Generate random string of given length,63,865,843,507,94,196,847,676
Python | Remove None values from list,64,509,490,232,213,979,585,598
Reading an excel file using Python openpyxl module,65,355,154,482,192,959,466,482
How to check if a set contains an element in Python?,66,751,174,633,924,314,728,605
Python Program to Print all Prime numbers in an Interval,67,244,122,613,743,784,756,30
Python Program for Breadth First Search or BFS for a Graph,68,876,156,680,814,891,358,333
How to add values to dictionary in Python,69,904,368,791,864,382,871,397
Python Program for n-th Fibonacci number,70,508,710,758,113,780,679,767
Python | Test if string contains element from list,71,843,170,231,186,306,184,618
Python program for word guessing game,72,940,959,598,934,845,961,501
Appending a dictionary to a list in Python,73,687,447,296,716,850,730,187
Running Python script on GPU.,74,848,827,686,409,927,546,199
Convert string to DateTime and vice-versa in Python,75,822,396,344,546,433,559,297
Python program to find the String in a List,76,478,401,519,785,184,828,808
Take Matrix input from user in Python,77,53,767,393,184,39,379,410
How to Compare Two Dictionaries in Python?,78,38,166,429,649,20,815,989
How to Get the Number of Elements in a Python List?,79,189,885,895,808,93,20,266
Python - Extract string between two substrings,80,777,74,838,774,648,552,6
Python Program for Depth First Search or DFS for a Graph,81,905,242,751,988,825,140,903
Python Program to Get the File Name From the File Path,82,830,0,397,870,632,715,788
Remove Last Element from List in Python,83,975,646,874,890,816,107,39
Python | Difference between two dates (in minutes) using datetime.timedelta() method,84,395,417,483,318,321,175,829
Python | Extract words from given string,85,758,551,480,241,986,717,467
Python Program to Find the Gcd of Two Numbers,86,602,917,417,322,2,426,405
Python program to print Pascal's Triangle,87,144,410,268,967,264,215,907
Python | Initialize a dictionary with only keys from a list,88,230,596,810,16,749,543,392
Python program to print all even numbers in a range,89,841,332,316,380,553,34,139
Python Program for Sum of squares of first n natural numbers,90,317,278,601,638,935,690,594
Python Program for Tower of Hanoi,91,282,735,132,921,521,148,51
Python program to check whether the string is Symmetrical or Palindrome,92,657,877,671,288,841,39,881
Check if email address valid or not in Python,93,357,59,790,325,322,797,577
Python | Split list into lists by particular value,94,465,449,408,975,373,104,743
Python | Get last N elements from given list,95,249,645,987,53,936,240,269
Python Program to Find Area of a Circle,96,513,383,625,612,414,450,906
Python program to print all odd numbers in a range,97,665,922,676,148,984,292,259
Python Program for Compound Interest,98,501,252,146,873,834,605,367
Python Program for Linear Search,99,536,83,407,497,511,689,874
Python | Find dictionary matching value in list,100,399,446,922,679,565,476,666
Python | Convert String to Binary,101,392,799,910,786,325,129,924
Find length of a string in python (6 ways),102,655,865,517,742,179,670,640
Python | Split a sentence into list of words,103,303,700,766,925,681,760,721
Generating random number list in Python,104,214,649,74,609,347,223,804
Python | Ways to change keys in dictionary,105,437,523,383,349,384,901,336
Python | Ways to concatenate tuples,106,135,290,866,617,866,440,127
Python | Program to print duplicates from a list of integers,107,64,342,951,724,423,584,828
Python Program for Array Rotation,108,997,746,800,233,51,399,486
Python implementation of automatic Tic Tac Toe game using random number,109,480,263,44,379,72,723,900
Python | Program to convert a tuple to a string,110,302,786,835,726,169,955,2
Python | Convert String to Tuple,111,208,196,138,986,191,720,129
Python | Ways to convert string to json object,112,90,810,697,908,331,653,362
Python | Replace multiple characters at once,113,984,659,861,682,263,675,644
Python program to get all unique combinations of two Lists,114,252,531,172,614,599,342,232
Find Median of List in Python,115,578,422,582,337,951,298,717
Python | Mean Squared Error,116,928,141,54,829,329,796,67
Python - Check if string contains any number,117,181,143,273,134,283,534,705
Python Program to Check if a Number is Odd or Even,118,179,169,194,528,390,245,42
Python | Convert dictionary to list of tuples,119,103,915,590,659,6,677,947
Python program to find number of days between two given dates,120,728,971,79,705,922,152,883
Python | Find position of a character in given string,121,853,9,785,733,25,10,821
Python program to convert integer to roman,122,182,622,338,398,621,235,650
Python | Increment value in dictionary,123,659,954,829,332,361,967,175
Python program to print Emojis,124,620,232,401,375,678,90,256
Python program to implement Rock Paper Scissor game,125,490,796,442,840,396,535,898
Python | Check if all elements in a list are identical,126,837,463,734,200,123,506,671
Python program to sort a list of tuples by second Item,127,66,27,641,665,319,428,822
Python | How to sort a list of strings,128,936,356,257,941,557,804,959
Python program to count Even and Odd numbers in a List,129,364,8,182,597,413,764,183
Python | Key index in Dictionary,130,584,982,189,417,731,250,185
Python program to print odd numbers in a List,131,680,399,108,275,878,638,280
Python | Longest String in list,132,761,282,898,41,10,687,361
Python - Copy contents of one file to another file,133,295,984,649,754,988,271,656
Python program to split and join a string,134,924,155,965,14,324,352,963
Python | Replace substring in list of strings,135,475,435,888,907,518,35,399
Python program to convert hex string to decimal,136,656,419,7,492,276,27,569
Python Program to Get the Class Name of an Instance,137,164,668,277,827,765,367,945
Check for balanced parentheses in Python,138,79,857,854,435,215,32,395
Python - Get first element in List of tuples,139,413,882,348,512,613,695,412
Python Check If String is Number,140,802,340,627,279,492,145,433
Python Program for Heap Sort,141,718,327,816,692,836,156,237
Python | Split on last occurrence of delimiter,142,363,501,745,713,334,363,782
"Python program to create Bankaccount class with deposit, withdraw function",143,531,55,308,691,115,116,673
Initialize Matrix in Python,144,286,359,208,963,689,508,557
Python - Draw Star Using Turtle Graphics,145,829,5,130,28,238,269,599
Python - Get the indices of all occurrences of an element in a list,146,56,164,156,872,389,798,491
Python - Count occurrences of each word in given text file,147,990,676,159,373,330,380,407
Python - Sum of tuple elements,148,169,10,617,896,470,513,493
Python - Validate String date format,149,653,456,423,248,619,609,475
Python Program to Convert Celsius To Fahrenheit,150,775,886,668,203,359,540,140
Build a Basic Form GUI using CustomTkinter module in Python,151,510,274,86,29,135,497,623
Program to check if a string contains any special character,152,780,520,871,102,893,718,807
Python | Reading contents of PDF using OCR (Optical Character Recognition),153,210,255,906,683,102,459,561
Python program to find the sum of all items in a dictionary,154,186,625,419,441,81,724,931
Python program to count number of vowels using sets in given string,155,105,457,259,77,703,976,753
Delete a directory or file using Python,156,316,19,737,553,482,188,844
Python | Maximum frequency character in String,157,973,301,152,191,826,331,555
Python | List of float to string conversion,158,116,519,287,416,793,625,202
Python - Remove Initial character in String List,159,753,960,755,420,724,15,726
Generating Word Cloud in Python,160,927,120,968,952,48,999,499
Python | Ways to flatten a 2D list,161,82,595,537,599,129,668,285
Python Program for N Queen Problem | Backtracking-3,162,484,93,123,821,796,411,324
Python | Finding strings with given substring in list,163,576,515,468,596,555,616,239
median() function in Python statistics module,164,375,148,529,547,554,489,207
Python program to solve quadratic equation,165,78,158,716,50,589,1,55
Python Program to Reverse a linked list,166,900,610,956,49,933,995,890
Python | Ways to convert Boolean values to integer,167,676,687,729,911,789,460,700
Python | Check if variable is tuple,168,362,498,118,751,926,824,19
Python | Split a list having single integer,169,972,377,103,668,342,209,825
Python Program for cube sum of first n natural numbers,170,541,97,53,273,980,630,754
Python | Check if element exists in list of lists,171,537,940,670,903,549,580,485
Python - All possible pairs in List,172,424,176,213,792,913,852,144
Python - Accessing Items in Lists Within Dictionary,173,535,663,202,210,994,246,920
Python - Convert String Truth values to Boolean,174,918,623,532,10,526,905,458
Python | All occurrences of substring in string,175,589,29,983,145,519,522,29
Find the size of a Tuple in Python,176,415,30,446,778,60,706,526
Python | Remove all characters except letters and numbers,177,934,651,120,122,899,940,167
Python - How to Iterate over nested dictionary ?,178,652,308,206,962,654,510,500
Python - Remove elements at Indices in List,179,815,628,981,312,116,190,83
Python Program for How to check if a given number is Fibonacci number?,180,521,192,440,621,70,264,524
Python | Get first element of each sublist,181,311,177,663,550,202,465,519
Python | Merge list elements,182,607,108,996,352,409,802,363
Python program to calculate the number of digits and letters in a string,183,825,828,491,537,203,147,279
Python Program to find if a character is vowel or Consonant,184,813,989,991,675,326,909,302
Python | Split dictionary keys and values into separate lists,185,461,557,230,449,137,641,928
Python | Standard deviation of list,186,40,444,825,627,767,660,824
Python - Store Function as dictionary value,187,663,518,413,758,864,75,994
Python | Insert a number in string,188,970,996,549,350,375,917,537
Python program to check if a string has at least one letter and one number,189,890,107,327,481,56,487,683
Create a dictionary with list comprehension in Python,190,185,91,954,673,534,712,217
21 Number game in Python,191,703,783,302,944,415,429,443
Find the length of a set in Python,192,987,538,336,711,126,614,463
Password validation in Python,193,493,648,0,919,585,878,411
Python - Mapping key values to Dictionary,194,497,985,771,445,426,0,439
Python | Minimum value keys in Dictionary,195,953,909,347,876,532,951,345
Iterate over words of a String in Python,196,935,903,15,467,810,302,548
Python - Test if String contains any Uppercase character,197,713,716,927,431,929,86,38
Python program to count the number of characters in a String,198,583,240,274,654,432,427,173
Python program to find N largest elements from a list,199,48,908,873,894,520,921,66
Python | Find keys with duplicate values in dictionary,200,677,261,976,889,29,792,813
Python | Combining two sorted lists,201,872,763,765,62,833,748,398
Python | Convert case of elements in a list of strings,202,414,589,70,68,34,260,701
Python | Check whether string contains only numbers or not,203,174,294,652,584,754,908,351
Python | Insert list in another list,204,393,976,909,813,664,321,422
Python | Check if all elements in a List are same,205,0,953,687,55,753,491,43
Program to create grade calculator in Python,206,159,740,145,101,869,384,301
Python | Merge two lists into list of tuples,207,131,4,665,898,363,452,28
Python program to find the factorial of a number using recursion,208,426,682,392,504,290,286,383
Python | Add comma between numbers,209,762,736,300,485,155,826,11
Python | Extract specific keys from dictionary,210,587,194,726,987,120,627,542
Python program to add two binary numbers,211,562,392,219,843,660,192,438
Python - Reading last N lines of a file,212,950,774,365,327,801,511,71
Python | Concatenate two lists element-wise,213,134,901,439,989,779,99,713
Python Program for Topological Sorting,214,468,760,436,354,616,793,451
Python | Convert Bytearray to Hexadecimal String,215,268,918,567,639,273,197,543
Python - Append Multiple elements in set,216,453,135,427,720,720,64,868
Python program to calculate age in year,217,887,848,857,37,457,53,319
Python Program for Sieve of Eratosthenes,218,943,726,414,823,379,131,684
Python | Assign multiple variables with list values,219,645,613,864,531,890,570,859
Python - Remove empty List from List,220,864,129,101,267,773,479,74
Python | Pair iteration in list,221,668,674,560,174,576,632,982
Python - Multiply two list,222,649,149,780,878,867,31,918
Python - Remove String from String List,223,29,532,418,698,451,282,401
Python | Convert String list to ascii values,224,598,952,978,383,847,83,278
How to format a string using a dictionary in Python,225,471,923,638,129,354,40,812
Python | String Split including spaces,226,412,672,681,839,684,516,91
Python - Wildcard Substring search,227,933,627,784,433,981,381,503
Python Program For Converting Roman Numerals To Decimal Lying Between 1 to 3999,228,551,46,367,979,208,362,244
Python Program to Split the array and add the first part to the end,229,548,928,396,321,618,361,177
Python | Find closest number to k in given list,230,1,322,707,695,9,555,92
Python | Convert list to Python array,231,565,981,606,779,792,8,466
Minimum of two numbers in Python,232,582,871,125,401,228,680,988
Python program to find the power of a number using recursion,233,139,640,515,981,420,345,326
Python Program to Return the Length of the Longest Word from the List of Words,234,658,997,536,284,434,21,992
Python Program to swap the First and the Last Character of a string,235,14,470,934,594,861,725,953
Python - Convert Float String List to Float Values,236,175,348,746,533,672,19,969
Create a Pong Game in Python - Pygame,237,765,32,321,473,515,238,877
Python | Removing dictionary from list of dictionaries,238,986,752,69,296,315,332,837
Python program to check if number is palindrome (one-liner),239,860,846,715,276,368,458,478
Python | Ways to convert hex into binary,240,946,481,630,664,153,374,592
Python | Ways to sort letters of string alphabetically,241,863,7,380,169,550,351,657
Python | Convert None to empty string,242,709,734,137,289,249,553,0
How to Create a Sparse Matrix in Python,243,517,902,269,69,416,237,305
Python - Reverse Dictionary Keys Order,244,263,812,657,573,928,856,476
Python - Avoid Spaces in string length,245,931,869,359,193,889,866,81
Python program to check a string for specific characters,246,993,302,16,769,140,258,626
Python | Get all substrings of given string,247,710,297,579,643,36,204,975
Python program to convert time from 12 hour to 24 hour format,248,621,285,703,577,748,682,425
Python program to sort and find the data in the student records,249,191,195,952,789,63,618,797
Python | Extract substrings between brackets,250,779,615,994,377,828,444,211
Python - Swap elements in String list,251,123,414,306,795,488,989,968
Python Program for 0-1 Knapsack Problem,252,19,430,803,238,852,57,786
numpy.diff() in Python,253,330,803,992,454,851,612,637
Sort the values of first list using second list in Python,254,994,797,653,501,376,731,986
Interquartile Range to Detect Outliers in Data,255,701,974,985,806,670,463,655
Program to print the pattern 'G',256,730,493,495,895,291,953,803
Python - Convert Snake Case String to Camel Case,257,87,892,764,887,949,875,223
Python program to find all possible pairs with given sum,258,274,329,163,571,162,531,135
"Python program to convert seconds into hours, minutes and seconds",259,172,673,104,739,863,517,118
Python: os.path.abspath() method with example,260,37,303,224,708,489,343,200
Python | Convert list of tuples into list,261,379,802,313,427,597,158,919
Python program to print negative numbers in a list,262,854,17,834,207,987,478,448
Python | Get the string after occurrence of given substring,263,293,385,250,232,403,359,254
Python | Append suffix/prefix to strings in list,264,704,304,928,648,218,44,961
Python subprocess module,265,981,189,949,848,609,885,763
Python program to Concatenate all Elements of a List into a String,266,552,16,109,245,441,168,620
How to create an empty class in Python?,267,812,905,46,749,564,335,453
Find sum and average of List in Python,268,52,175,523,72,998,565,882
Python | Filter list of strings based on the substring list,269,899,79,497,106,445,263,967
Creating a list of range of dates in Python,270,951,951,21,460,652,527,87
Python | Addition of tuples,271,852,898,796,80,806,91,413
Python Program for Efficient program to print all prime factors of a given number,272,341,439,702,671,605,855,589
Python | Sum of number digits in List,273,120,669,90,669,606,699,315
Python | Operation to each element in list,274,995,464,450,188,909,349,449
Python | Boolean list initialization,275,504,471,966,715,28,47,158
Python | Find the list elements starting with specific letter,276,895,289,905,108,622,977,495
Python program to count the number of spaces in string,277,574,561,868,286,454,775,574
Ways to extract all dictionary values | Python,278,919,225,505,39,175,937,956
Python - Dictionary Values Mean,279,8,832,570,75,881,536,252
Python | Remove substring list from String,280,678,210,284,98,572,397,327
Python Program to Convert Binary to Hexadecimal,281,328,794,30,508,799,133,966
How to append a NumPy array to an empty array in Python,282,183,339,89,158,702,98,390
Python program to find power of a number,283,435,305,29,88,76,886,40
Python program to count positive and negative numbers in a list,284,632,288,845,165,584,495,614
Python | Separate odd and even index elements,285,675,239,476,935,953,4,378
Python program to Swap Keys and Values in Dictionary,286,684,814,923,44,312,707,876
Python Program to Swap Two Variables,287,223,469,51,646,189,933,784
Python | Ways to print list without quotes,288,354,545,921,703,310,704,52
Python Program to print all Possible Combinations from the three Digits,289,647,805,3,913,7,964,990
Python Program to find transpose of a matrix,290,127,816,143,209,545,562,109
Python | Check if any element in list satisfies a condition,291,278,609,558,404,712,619,156
Gauss–Seidel method,292,723,191,685,888,771,975,89
How to generate Large Prime numbers for RSA Algorithm,293,643,84,600,447,443,76,309
Python program to insert an element into sorted list,294,500,719,673,897,27,115,737
Python | Truncate a list,295,65,639,411,456,397,919,773
Python program to find Last date of Month,296,444,626,527,800,823,898,205
Python | Test if element is dictionary value,297,266,698,201,625,79,265,90
Python | Add trailing Zeros to string,298,472,978,463,206,704,199,460
Python - Create a Dictionary with Key as First Character and Value as Words Starting with that Character,299,94,364,539,406,990,231,197
Python Program to check date in date range,300,754,890,849,601,697,872,622
PySpark - Apply custom schema to a DataFrame,301,868,362,28,212,349,533,65
Python Program to Accept the Strings Which Contains all Vowels,302,132,183,487,560,642,894,142
Python | Dividing two lists,303,168,95,577,51,205,739,736
Python program to print all negative numbers in a range,304,276,790,619,137,901,77,996
How to find the Fourier Transform of an image using OpenCV Python?,305,76,389,742,978,220,378,137
Python program to print even length words in a string,306,427,546,831,114,164,179,704
Python | Convert Tuple to integer,307,114,213,732,18,344,569,733
Python | Splitting Text and Number in string,308,58,630,294,624,904,658,311
Filter Color with OpenCV,309,272,977,915,493,983,539,835
Python - Remove duplicate values in dictionary,310,538,706,255,394,978,183,926
Python Program to find whether a no is power of two,311,856,822,421,631,271,481,940
Python - Extract Unique values dictionary values,312,964,480,94,964,26,590,528
Python program to convert camel case string to snake case,313,405,343,173,881,225,423,716
Python | Absolute value of list elements,314,834,653,635,76,195,902,477
Python | Add keys to nested dictionary,315,608,321,444,256,333,604,347
Python Program to perform cross join in Pandas,316,619,704,666,111,529,485,248
Python | Print an Inverted Star Pattern,317,749,946,860,70,346,865,521
Python | Split string in groups of n consecutive characters,318,251,751,36,581,778,782,299
Python | Sort a Dictionary,319,755,68,811,822,490,277,659
Python - Convert Key-Value list Dictionary to List of Lists,320,690,914,351,991,650,222,910
Python | Check if a list is contained in another list,321,506,747,817,311,643,415,987
"Python program to print current hour, minute, second and microsecond",322,971,115,717,364,458,929,489
Python | Dictionary with index as value,323,336,563,912,949,839,578,403
Python Program for ShellSort,324,929,238,35,48,62,968,586
Python Program for Remove leading zeros from a Number given as a string,325,692,224,611,317,209,29,372
Program to print all the numbers divisible by 3 and 5 for a given number,326,519,930,434,405,941,501,538
Find current weather of any city using OpenWeatherMap API in Python,327,661,296,153,762,592,935,242
Binary Search (bisect) in Python,328,381,686,736,27,916,831,417
Python program to print positive numbers in a list,329,560,838,394,912,148,169,10
